{
  "change": "apply-account-slot-commands",
  "generatedAt": "2026-10-29T05:35:46.640Z",
  "devCommit": "115c16c41016ae5f45dee6609558a9299ef8b165",
  "headCommit": "f9093de0e073963d5985b11643b4cc1358d9da5b",
  "features": {
    "linesChanged": 1197,
    "filesChanged": 24,
    "capabilities": [
      "account-pool-port"
    ],
    "touches": {
      "code": true,
      "tests": true,
      "contracts": true,
      "specs": true,
      "docker": false,
      "security": true,
      "docsOnly": false
    },
    "externalFacts": false,
    "size": "L",
    "capabilityHistory": {
      "changes": 8,
      "thirdPassShare": 0.5,
      "mediumOrWorsePerChange": 7.75
    }
  },
  "rule": {
    "version": 2,
    "tier": "elevated",
    "triggers": [
      "lines",
      "files",
      "security",
      "contracts",
      "size"
    ],
    "passes": [
      {
        "pass": 1,
        "role": "A",
        "reviewer": {
          "harness": "codex",
          "model": "gpt-6-astra",
          "variant": "high"
        }
      },
      {
        "pass": 2,
        "role": "B",
        "reviewer": {
          "harness": "claude",
          "model": "claude-opus-5-5",
          "variant": "xhigh"
        }
      },
      {
        "pass": 3,
        "role": "A",
        "reviewer": {
          "harness": "codex",
          "model": "gpt-6.1-sol",
          "variant": "high"
        }
      }
    ]
  },
  "shadow": {
    "router": "jev",
    "status": "answered",
    "model": "jev-1.14.0",
    "tier": "elevated",
    "thirdPassProbability": 0.79,
    "threshold": 0.4,
    "passes": [
      {
        "pass": 1,
        "role": "A",
        "reviewer": {
          "harness": "codex",
          "model": "gpt-6-astra",
          "variant": "high"
        }
      },
      {
        "pass": 2,
        "role": "B",
        "reviewer": {
          "harness": "claude",
          "model": "claude-opus-5-5",
          "variant": "xhigh"
        }
      },
      {
        "pass": 3,
        "role": "A",
        "reviewer": {
          "harness": "codex",
          "model": "gpt-6.1-sol",
          "variant": "high"
        }
      }
    ],
    "latencyMs": 270
  }
}
