{
  "change": "route-reviewers-by-change-complexity",
  "generatedAt": "2026-10-28T07:09:01.510Z",
  "devCommit": "f3a53f172dc265d5e710105df3f5dbe5be99a24a",
  "headCommit": "8ae465c98ee786e4959436a0fa0d9c57bfe0c0f1",
  "features": {
    "linesChanged": 4117,
    "filesChanged": 36,
    "capabilities": [
      "agent-task-protocol",
      "review-process"
    ],
    "touches": {
      "code": true,
      "tests": true,
      "contracts": false,
      "specs": true,
      "docker": false,
      "security": false,
      "docsOnly": false
    },
    "externalFacts": true,
    "size": "M",
    "capabilityHistory": {
      "changes": 9,
      "thirdPassShare": 0.5555555555555556,
      "mediumOrWorsePerChange": 4.777777777777778
    }
  },
  "rule": {
    "version": 1,
    "tier": "elevated",
    "triggers": [
      "lines",
      "files"
    ],
    "passes": [
      {
        "pass": 1,
        "role": "A",
        "reviewer": {
          "harness": "claude",
          "model": "claude-fable-5-1",
          "variant": "high"
        }
      },
      {
        "pass": 2,
        "role": "B",
        "reviewer": {
          "harness": "claude",
          "model": "claude-opus-5-5",
          "variant": "xhigh"
        }
      }
    ]
  },
  "shadow": {
    "router": "jev",
    "status": "failed",
    "reason": "missing-credential",
    "latencyMs": 0
  }
}
