{
  "change": "apply-account-pool-cooldown-and-affinity",
  "generatedAt": "2026-10-29T00:22:15.567Z",
  "devCommit": "f882c0ac665f46cdb766d18f20bfdf81bed9fadd",
  "headCommit": "3696d3afc5d9ebd539e22c31731cd3ce9f040653",
  "features": {
    "linesChanged": 848,
    "filesChanged": 12,
    "capabilities": [
      "account-pool-port"
    ],
    "touches": {
      "code": true,
      "tests": true,
      "contracts": true,
      "specs": true,
      "docker": false,
      "security": false,
      "docsOnly": false
    },
    "externalFacts": false,
    "size": "M",
    "capabilityHistory": {
      "changes": 6,
      "thirdPassShare": 0.3333333333333333,
      "mediumOrWorsePerChange": 8.666666666666666
    }
  },
  "rule": {
    "version": 2,
    "tier": "elevated",
    "triggers": [
      "lines",
      "contracts"
    ],
    "passes": [
      {
        "pass": 1,
        "role": "A",
        "reviewer": {
          "harness": "codex",
          "model": "gpt-6-astra",
          "variant": "high"
        }
      },
      {
        "pass": 2,
        "role": "B",
        "reviewer": {
          "harness": "claude",
          "model": "claude-opus-5-5",
          "variant": "xhigh"
        }
      },
      {
        "pass": 3,
        "role": "A",
        "reviewer": {
          "harness": "codex",
          "model": "gpt-6.1-sol",
          "variant": "high"
        }
      }
    ]
  },
  "shadow": {
    "router": "jev",
    "status": "answered",
    "model": "jev-1.14.0",
    "tier": "elevated",
    "thirdPassProbability": 0.7,
    "threshold": 0.4,
    "passes": [
      {
        "pass": 1,
        "role": "A",
        "reviewer": {
          "harness": "codex",
          "model": "gpt-6-astra",
          "variant": "high"
        }
      },
      {
        "pass": 2,
        "role": "B",
        "reviewer": {
          "harness": "claude",
          "model": "claude-opus-5-5",
          "variant": "xhigh"
        }
      },
      {
        "pass": 3,
        "role": "A",
        "reviewer": {
          "harness": "codex",
          "model": "gpt-6.1-sol",
          "variant": "high"
        }
      }
    ],
    "latencyMs": 261
  }
}
