{
  "change": "run-reviews-through-make",
  "generatedAt": "2026-10-28T11:28:32.838Z",
  "devCommit": "bbce0e81d8e6a7a5ec0098e6c23655f80676c2c9",
  "headCommit": "1365a9f537d984caf6cb89a0c7eb8b0238f682d1",
  "features": {
    "linesChanged": 986,
    "filesChanged": 8,
    "capabilities": [
      "review-process"
    ],
    "touches": {
      "code": true,
      "tests": true,
      "contracts": false,
      "specs": true,
      "docker": false,
      "security": false,
      "docsOnly": false
    },
    "externalFacts": false,
    "size": "S-M",
    "capabilityHistory": {
      "changes": 10,
      "thirdPassShare": 0.6,
      "mediumOrWorsePerChange": 4.5
    }
  },
  "rule": {
    "version": 1,
    "tier": "elevated",
    "triggers": [
      "lines"
    ],
    "passes": [
      {
        "pass": 1,
        "role": "A",
        "reviewer": {
          "harness": "codex",
          "model": "gpt-6.1-sol",
          "variant": "high"
        }
      },
      {
        "pass": 2,
        "role": "B",
        "reviewer": {
          "harness": "claude",
          "model": "claude-opus-5-5",
          "variant": "xhigh"
        }
      }
    ]
  },
  "shadow": {
    "router": "jev",
    "status": "answered",
    "model": "jev-1.14.0",
    "tier": "elevated",
    "confidence": 0.18,
    "probabilities": {
      "standard": 0.41,
      "elevated": 0.59
    },
    "expectedPasses": 2.5300000000000002,
    "passes": [
      {
        "pass": 1,
        "role": "A",
        "reviewer": {
          "harness": "codex",
          "model": "gpt-6.1-sol",
          "variant": "high"
        }
      },
      {
        "pass": 2,
        "role": "B",
        "reviewer": {
          "harness": "claude",
          "model": "claude-opus-5-5",
          "variant": "xhigh"
        }
      }
    ],
    "latencyMs": 255
  }
}
