{
  "change": "record-verify-stamp-reuse",
  "generatedAt": "2026-10-28T19:59:08.002Z",
  "devCommit": "1666739982106ec3e9663978b4f86cdd2fb72f1f",
  "headCommit": "cd5e2dcdb3a984c24232ef4104c12ef17caaa8f3",
  "features": {
    "linesChanged": 137,
    "filesChanged": 3,
    "capabilities": [
      "integration-flow"
    ],
    "touches": {
      "code": true,
      "tests": true,
      "contracts": false,
      "specs": true,
      "docker": false,
      "security": false,
      "docsOnly": false
    },
    "externalFacts": false,
    "size": "S",
    "capabilityHistory": {
      "changes": 4,
      "thirdPassShare": 0.25,
      "mediumOrWorsePerChange": 5.75
    }
  },
  "rule": {
    "version": 2,
    "tier": "standard",
    "triggers": [],
    "passes": [
      {
        "pass": 1,
        "role": "A",
        "reviewer": {
          "harness": "codex",
          "model": "gpt-6-astra",
          "variant": "medium"
        }
      },
      {
        "pass": 2,
        "role": "B",
        "reviewer": {
          "harness": "claude",
          "model": "claude-opus-5-5",
          "variant": "medium"
        }
      },
      {
        "pass": 3,
        "role": "A",
        "reviewer": {
          "harness": "codex",
          "model": "gpt-6.1-sol",
          "variant": "medium"
        }
      }
    ]
  },
  "shadow": {
    "router": "jev",
    "status": "answered",
    "model": "jev-1.14.0",
    "tier": "standard",
    "thirdPassProbability": 0.37,
    "threshold": 0.4,
    "passes": [
      {
        "pass": 1,
        "role": "A",
        "reviewer": {
          "harness": "codex",
          "model": "gpt-6-astra",
          "variant": "medium"
        }
      },
      {
        "pass": 2,
        "role": "B",
        "reviewer": {
          "harness": "claude",
          "model": "claude-opus-5-5",
          "variant": "medium"
        }
      },
      {
        "pass": 3,
        "role": "A",
        "reviewer": {
          "harness": "codex",
          "model": "gpt-6.1-sol",
          "variant": "medium"
        }
      }
    ],
    "latencyMs": 280
  }
}
