{
  "change": "record-the-review-sequence",
  "generatedAt": "2026-10-28T19:02:54.097Z",
  "devCommit": "aff291bbfb41cd6adedc78f3c4122865a84e5f63",
  "headCommit": "fbea70a40727333aa8017b96c9909ebb9ac32ae7",
  "features": {
    "linesChanged": 458,
    "filesChanged": 21,
    "capabilities": [
      "review-process"
    ],
    "touches": {
      "code": true,
      "tests": true,
      "contracts": false,
      "specs": true,
      "docker": false,
      "security": false,
      "docsOnly": false
    },
    "externalFacts": false,
    "size": "M",
    "capabilityHistory": {
      "changes": 12,
      "thirdPassShare": 0.6666666666666666,
      "mediumOrWorsePerChange": 4.666666666666667
    }
  },
  "rule": {
    "version": 2,
    "tier": "elevated",
    "triggers": [
      "lines",
      "files"
    ],
    "passes": [
      {
        "pass": 1,
        "role": "A",
        "reviewer": {
          "harness": "codex",
          "model": "gpt-6-astra",
          "variant": "high"
        }
      },
      {
        "pass": 2,
        "role": "B",
        "reviewer": {
          "harness": "claude",
          "model": "claude-opus-5-5",
          "variant": "xhigh"
        }
      },
      {
        "pass": 3,
        "role": "A",
        "reviewer": {
          "harness": "codex",
          "model": "gpt-6.1-sol",
          "variant": "high"
        }
      }
    ]
  },
  "shadow": {
    "router": "jev",
    "status": "answered",
    "model": "jev-1.14.0",
    "tier": "elevated",
    "thirdPassProbability": 0.8,
    "threshold": 0.4,
    "passes": [
      {
        "pass": 1,
        "role": "A",
        "reviewer": {
          "harness": "codex",
          "model": "gpt-6-astra",
          "variant": "high"
        }
      },
      {
        "pass": 2,
        "role": "B",
        "reviewer": {
          "harness": "claude",
          "model": "claude-opus-5-5",
          "variant": "xhigh"
        }
      },
      {
        "pass": 3,
        "role": "A",
        "reviewer": {
          "harness": "codex",
          "model": "gpt-6.1-sol",
          "variant": "high"
        }
      }
    ],
    "latencyMs": 274
  }
}
