{
  "change": "deliver-rotated-worker-credentials",
  "generatedAt": "2026-10-28T14:15:16.100Z",
  "devCommit": "7efc48d330b49bbdaebc370e95f42d3c2bec211e",
  "headCommit": "ee76ce9a52fdbd5bd8a2621b111b43a336e4af8d",
  "features": {
    "linesChanged": 2993,
    "filesChanged": 78,
    "capabilities": [
      "control-plane-api",
      "execution-wire-contracts",
      "installation-enrollment",
      "nats-transport",
      "worker-journal-adapter",
      "worker-runtime"
    ],
    "touches": {
      "code": true,
      "tests": true,
      "contracts": true,
      "specs": true,
      "docker": false,
      "security": true,
      "docsOnly": false
    },
    "externalFacts": false,
    "size": "L",
    "capabilityHistory": {
      "changes": 11,
      "thirdPassShare": 0.6363636363636364,
      "mediumOrWorsePerChange": 7.545454545454546
    }
  },
  "rule": {
    "version": 1,
    "tier": "elevated",
    "triggers": [
      "lines",
      "files",
      "capabilities",
      "security",
      "contracts",
      "size"
    ],
    "passes": [
      {
        "pass": 1,
        "role": "A",
        "reviewer": {
          "harness": "codex",
          "model": "gpt-6.1-sol",
          "variant": "high"
        }
      },
      {
        "pass": 2,
        "role": "B",
        "reviewer": {
          "harness": "claude",
          "model": "claude-opus-5-5",
          "variant": "xhigh"
        }
      }
    ]
  },
  "shadow": {
    "router": "jev",
    "status": "answered",
    "model": "jev-1.14.0",
    "tier": "elevated",
    "confidence": 1,
    "probabilities": {
      "standard": 0,
      "elevated": 1
    },
    "expectedPasses": 2.83,
    "passes": [
      {
        "pass": 1,
        "role": "A",
        "reviewer": {
          "harness": "codex",
          "model": "gpt-6.1-sol",
          "variant": "high"
        }
      },
      {
        "pass": 2,
        "role": "B",
        "reviewer": {
          "harness": "claude",
          "model": "claude-opus-5-5",
          "variant": "xhigh"
        }
      }
    ],
    "latencyMs": 290
  }
}
