{
  "change": "implement-git-remote-operations",
  "generatedAt": "2026-10-28T11:06:28.408Z",
  "devCommit": "803c7057549993b6d351377c1b4c68b94e6981c6",
  "headCommit": "94deb81942cd06b2cbbee7ab17df7b5726ae85aa",
  "features": {
    "linesChanged": 816,
    "filesChanged": 13,
    "capabilities": [
      "git-workspace-port"
    ],
    "touches": {
      "code": true,
      "tests": true,
      "contracts": true,
      "specs": true,
      "docker": false,
      "security": false,
      "docsOnly": false
    },
    "externalFacts": false,
    "size": "M",
    "capabilityHistory": {
      "changes": 7,
      "thirdPassShare": 0.7142857142857143,
      "mediumOrWorsePerChange": 12.142857142857142
    }
  },
  "rule": {
    "version": 1,
    "tier": "elevated",
    "triggers": [
      "lines",
      "contracts"
    ],
    "passes": [
      {
        "pass": 1,
        "role": "A",
        "reviewer": {
          "harness": "codex",
          "model": "gpt-6.1-sol",
          "variant": "high"
        }
      },
      {
        "pass": 2,
        "role": "B",
        "reviewer": {
          "harness": "claude",
          "model": "claude-opus-5-5",
          "variant": "xhigh"
        }
      }
    ]
  },
  "shadow": {
    "router": "jev",
    "status": "answered",
    "model": "jev-1.14.0",
    "tier": "elevated",
    "confidence": 0.98,
    "probabilities": {
      "standard": 0.01,
      "elevated": 0.99
    },
    "expectedPasses": 2.6,
    "passes": [
      {
        "pass": 1,
        "role": "A",
        "reviewer": {
          "harness": "codex",
          "model": "gpt-6.1-sol",
          "variant": "high"
        }
      },
      {
        "pass": 2,
        "role": "B",
        "reviewer": {
          "harness": "claude",
          "model": "claude-opus-5-5",
          "variant": "xhigh"
        }
      }
    ],
    "latencyMs": 218
  }
}
