{
  "change": "continue-after-context-warning",
  "generatedAt": "2026-10-28T21:15:23.533Z",
  "devCommit": "c49cb6a3a2e12e6b4f9a503b2c5d67fc258726d3",
  "headCommit": "4feb840c077b79b7164f212b1a5dc4906537746c",
  "features": {
    "linesChanged": 10,
    "filesChanged": 4,
    "capabilities": [
      "agent-task-protocol"
    ],
    "touches": {
      "code": false,
      "tests": false,
      "contracts": false,
      "specs": true,
      "docker": false,
      "security": false,
      "docsOnly": true
    },
    "externalFacts": false,
    "size": "S",
    "capabilityHistory": {
      "changes": 7,
      "thirdPassShare": 0.7142857142857143,
      "mediumOrWorsePerChange": 5.714285714285714
    }
  },
  "rule": {
    "version": 2,
    "tier": "standard",
    "triggers": [],
    "passes": [
      {
        "pass": 1,
        "role": "A",
        "reviewer": {
          "harness": "codex",
          "model": "gpt-6-astra",
          "variant": "medium"
        }
      },
      {
        "pass": 2,
        "role": "B",
        "reviewer": {
          "harness": "claude",
          "model": "claude-opus-5-5",
          "variant": "medium"
        }
      },
      {
        "pass": 3,
        "role": "A",
        "reviewer": {
          "harness": "codex",
          "model": "gpt-6.1-sol",
          "variant": "medium"
        }
      }
    ]
  },
  "shadow": {
    "router": "jev",
    "status": "answered",
    "model": "jev-1.14.0",
    "tier": "elevated",
    "thirdPassProbability": 0.4,
    "threshold": 0.4,
    "passes": [
      {
        "pass": 1,
        "role": "A",
        "reviewer": {
          "harness": "codex",
          "model": "gpt-6-astra",
          "variant": "high"
        }
      },
      {
        "pass": 2,
        "role": "B",
        "reviewer": {
          "harness": "claude",
          "model": "claude-opus-5-5",
          "variant": "xhigh"
        }
      },
      {
        "pass": 3,
        "role": "A",
        "reviewer": {
          "harness": "codex",
          "model": "gpt-6.1-sol",
          "variant": "high"
        }
      }
    ],
    "latencyMs": 280
  }
}
