{
  "change": "bind-evidence-to-code-head",
  "generatedAt": "2026-10-28T09:11:41.247Z",
  "devCommit": "9196804b89c6a20806beee7fd73c22459c548241",
  "headCommit": "ef9b0d27d6879d82e6150916a3a6de9e3e196fc7",
  "features": {
    "linesChanged": 448,
    "filesChanged": 10,
    "capabilities": [
      "sdlc-gates",
      "sdlc-wire-contracts",
      "sdlc-workflow-model"
    ],
    "touches": {
      "code": true,
      "tests": true,
      "contracts": true,
      "specs": true,
      "docker": false,
      "security": false,
      "docsOnly": false
    },
    "externalFacts": false,
    "size": "M",
    "capabilityHistory": {
      "changes": 0,
      "thirdPassShare": null,
      "mediumOrWorsePerChange": null
    }
  },
  "rule": {
    "version": 1,
    "tier": "elevated",
    "triggers": [
      "lines",
      "capabilities",
      "contracts"
    ],
    "passes": [
      {
        "pass": 1,
        "role": "A",
        "reviewer": {
          "harness": "codex",
          "model": "gpt-6.1-sol",
          "variant": "high"
        }
      },
      {
        "pass": 2,
        "role": "B",
        "reviewer": {
          "harness": "claude",
          "model": "claude-opus-5-5",
          "variant": "xhigh"
        }
      }
    ]
  },
  "shadow": {
    "router": "jev",
    "status": "answered",
    "model": "jev-1.14.0",
    "tier": "elevated",
    "confidence": 0.96,
    "probabilities": {
      "standard": 0.02,
      "elevated": 0.98
    },
    "expectedPasses": 2.06,
    "passes": [
      {
        "pass": 1,
        "role": "A",
        "reviewer": {
          "harness": "codex",
          "model": "gpt-6.1-sol",
          "variant": "high"
        }
      },
      {
        "pass": 2,
        "role": "B",
        "reviewer": {
          "harness": "claude",
          "model": "claude-opus-5-5",
          "variant": "xhigh"
        }
      }
    ],
    "latencyMs": 310
  }
}
